id,tweetText,tweetURL,type,tweetAuthor,handle,replyCount,quoteCount,retweetCount,likeCount,views,bookmarkCount,createdAt,allMediaURL,videoURL
1949858053194453191,"Minhas amigas e meus amigos. É com grande orgulho e imensa alegria que informo: O Brasil está fora do mapa da fome, mais uma vez.

O anúncio foi feito hoje (28) pela FAO/ONU. Isso significa que reduzimos a insegurança alimentar grave e a subnutrição para menos de 2,5% da população. Uma conquista histórica que mostra que com políticas públicas sérias e compromisso com o povo, é possível combater a fome e construir um país mais justo e solidário.",https://x.com/LulaOficial/status/1949858053194453191,tweet,Lula,@LulaOficial,3737,1763,14917,90886,2443403,758,2025-07-28 12:42:41,https://pbs.twimg.com/media/Gw9JfP8W8AAF1dU.jpg,
1949835964739944499,Presidente Lula participa da cerimônia da inauguração de usina a gás natural no Rio de Janeiro https://t.co/2XtaZFlyFC,https://x.com/LulaOficial/status/1949835964739944499,tweet,Lula,@LulaOficial,361,40,763,3586,70546,17,2025-07-28 11:14:54,,
1949821958935195754,"Bom dia. Sigo para o Rio de Janeiro, onde logo mais iremos inaugurar a maior usina a gás natural do país, no Porto do Açú. Obra do Novo PAC, essa usina contou com investimento de R$ 7 bilhões e gerou 10 mil empregos. Ela tem capacidade de fornecer energia a 8 milhões de residências.

À tarde, estaremos de volta ao Palácio do Planalto para sancionar o Acredita Exportação, um programa de iniciativa do Governo Federal que estabelece a devolução de tributos pagos por micro e pequenas empresas exportadoras. 

Desejo uma boa semana a todos.",https://x.com/LulaOficial/status/1949821958935195754,tweet,Lula,@LulaOficial,643,56,1207,6673,122106,37,2025-07-28 10:19:15,https://pbs.twimg.com/media/Gw8oSboWQAAcLCW.jpg,
1949446138056098131,"Política de segurança alimentar e combate à desigualdade, o Bolsa Família tem garantido as condições para que milhões de famílias conquistem sua autonomia e prosperem. Só em julho  deste ano quase um milhão delas deixou o programa devido ao aumento de renda.

Em 2024, 75% dos empregos de carteira assinada criados no Brasil foram ocupados por beneficiários do Bolsa Família. É por um Brasil com oportunidades para todos que seguimos trabalhando todos os dias.",https://x.com/LulaOficial/status/1949446138056098131,tweet,Lula,@LulaOficial,940,30,1152,5680,94938,36,2025-07-27 09:25:52,https://pbs.twimg.com/amplify_video_thumb/1949439385629343744/img/9bcTdsB2JQVO6sgE.jpg,https://video.twimg.com/amplify_video/1949439385629343744/vid/avc1/1920x1080/BE_zAd-JvgAxGPXe.mp4?tag=21